832907|2020-08-01 19:15:29|Normalizar Aerogeradores ICZ-10 e ICZ-11 após desligamento intempestivo do dia 31  07  2020
832992|2020-08-03 10:08:13|Intervenção no Sistema Digital, fim realizar a integração e testes nos Níveis 2 e 3 do Painel de Interface para permitir a futuraenergização da LT 04S7 PEN  NSC.
833125|2020-08-03 17:00:38|Substituição dos rolamentos de duas pás do WTG22 do Parque Eólico Renascença II.
833242|2020-08-04 11:24:24|CHESF efetuar termovisão terminal 12J7  PRD(32J7-5  PRD).
833294|2020-08-04 14:37:26|REORGANIZAÇÃO DE INFRAESTRUTURA DE REDE E TELEFONIA NA SALA DOS SERVIDORES DA USINA CHAVANTES.
833322|2020-08-04 15:35:44|REALIZAÇÃO DE TRABALHOS DE MEDIÇÃO DE DESCARGA LÍQUIDA E SÓLIDA A JUSANTE DA USINA.
833342|2020-08-04 16:22:40|Equipes DORBP  JPW  ESC: Efetuar integração do MPCCSR da EL09W3 e ativos associados, painel 9UA2D, disjuntor 19W3, TCs 99W3-1 e 99W3-2 e TP 89W3.
833370|2020-08-04 17:43:12|REFORMA GERAL DA COMPORTA DE SEGMENTO N.º 1 DO VERTEDOURO DE SUPERFÍCIE. E CUBÍCULO.
833506|2020-08-05 14:19:11|Bloqueio da proteção diferencial da barra 230kV da SE CSO, para permitir manobras de transferência dos circuitos da barra BP-1 para a barra BP-2 programadas para atender ao SGI 31513-20. O bloqueio será necessário das 09:15 as 10:00hs (sgi 31554-20) e novamente das 16:15 as 17:00Hs por este SGI
833490|2020-08-05 13:15:02|Alteração na lógica do SEP - CONTROLE DE CARREGAMENTO NA TRANSFORMAÇÃO 230  69  13,8 KV DA SE SIDERÓPOLIS para atender configuração provisória CFL-SRS 1 e desligamento do TF 4, conforme SGI 26.799-20.
833628|2020-08-06 09:42:42|Realizar a troca dos PEERs de conexão VPN que entrará na nova estrutura de rede do COS (estrutura de alta disponibilidade).
833649|2020-08-06 11:04:12|CHESF   DETA  REALIZAR TESTES SIMULADOS DE INTERTRAVAMENTOS NA LT 04S3-FZD  CPE.
833650|2020-08-06 11:06:06|TRANSFERENCIA DE APROXIMADAMENTE 23MW DO REGIONAL FTZ PARA O REGIONAL PCD.
833662|2020-08-06 11:58:50|SE JATAI . Painel QPC1-COMServiços: Verificação dos Logs de Comunicação da D400 Principal no painel QPC1-COM, que atualmente está fora de serviço. -Restabelecer a comunicação em modo serial com a D400 e caso necessário recarregar o programa da D400 principal  -Restabelecer a arquitetura com as D400s (Principal e Retaguarda) em operação
833704|2020-08-06 14:54:18|Deligamento intempestivo causado pelo rompimento da base da para-raio Fase   B   C09C9
833763|2020-08-06 17:37:03|Indisponibilidade do pórtico de 140T.- Utilização do pórtico para limpeza dos guiamentos dos stop logs da UG-01.- Utilização do pórtico para fechamento da UG-01.
833778|2020-08-06 18:18:23|Atualização da base de dados do sistema de supervisão, backup e limpeza referente  a manutenção periodica de  6 anos na RMM
833845|2020-08-07 10:15:49|Manutenção para realizar o comissionamento do novo Retificador e Banco de Baterias que substituirão os atualmente existentes nas posições 200R2 e 900A2.Serviços correlatos: 1. Atualização da base do SAGE   2. Pré-teste 7UA9   3. Comissionamento da nova unidade retificadora QR2 e do Banco de Baterias 2 com o painel 7UA9.
833848|2020-08-07 10:21:30|TESTES DE ESTADO ABERTO, INCONSISTENTE E FECHADO DE SECCIONADORAS E DISJUNTORES DO SETOR DE 500KV NO SAGE ATRAVÉS DE SIMULAÇÃO NAS ENTRADAS DIGITAIS DAS UACS 24, 25, 26 E 27  ALTERAR BASE DE DADOS DO SAGE
834131|2020-08-10 10:59:51|INSTALAÇÃO DE MONITORAÇÃO NOS PAINÉIS CIC-A,CIC-B E CIC-C PARA INVESTIGAR OCORRÊNCIA DE ALARMES INTERMITENENTES SUDDEN LOSS OF BIPOLE.
834173|2020-08-10 13:05:07|Manutenção anual preventiva no Sistema de Supervisão e Controle da SE Santa Rosa.
834241|2020-08-10 15:57:57|Verificar falha de comunicação dos relés de proteção principal e alternado da LT 138 kV BAB  BOT C-1 em BOT.
834348|2020-08-11 09:14:03|Instalação dos seguintes equipamentos:Banco de Reatores 1 (Disjuntor 19E11)Filtro Harmônico 1 (Disjuntor 19Q11)Banco de Capacitores 1 (19H11)Banco de Reatores 2 (Disjuntor 19E12)Filtro Harmônico 2 (Disjuntor 19Q12)Banco de Capacitores 2 (19H12)Banco de Reatores 3 (Disjuntor 19E21)Filtro Harmônico 3 (Disjuntor 19Q21)Banco de Capacitores 3 (19H21)Banco de Reatores 4 (Disjuntor 19E22)Filtro Harmônico 4 (Disjuntor 19Q22)Banco de Capacitores 4 (19H22)
834362|2020-08-11 09:47:06|Relizar ensaios de manobras de disjuntores na SE IPU 50Hz para testes de funcionamento do novo sistema SCADA.
834374|2020-08-11 10:17:58|Manutenção preventiva mensal do GMG da SE Oriximiná.
834623|2020-08-12 10:46:13|ATUALIZAR BASE DE DADOS DO SAGE - SICCP DA SE ALTAMIRA
834625|2020-08-12 10:50:33|ATUALIZAR BASE DE DADOS DO SAGE - SICCP DA SE TRANSAMAZÔNICA
834716|2020-08-12 16:14:39|LIBERAÇÃO DA LT 02V4 MTT-CDL PARA RETIRADA MANUTENÇÃO DO 12V4 DA SE CDL
834806|2020-08-13 09:05:29|Execução de manutenção corretiva para solução de problemas observados no link MPLS da localidade do Rio de Janeiro. A manutenção não ocasionará indisponibilidade no serviço de dados, voz e vídeo da localidade.  A duração estimada para a conclusão da atividade será de 03 (três) horas, iniciando às 08:00 horas, sendo concluída as 11:00 horas.
834817|2020-08-13 09:27:16|Manutenção nos equipamentos de comunicação,afim de evitar falha de comunicação com ONS.
834887|2020-08-13 13:25:05|Realizar alteração na configuração do FOX principal e alternado, referente aos ativos da LMTE.
834977|2020-08-13 17:45:55|Acessante TJMM  Cymi, e contratadas, com o acompanhamento da CHESF realizarão a substituição da proteção diferencial de barras 230 kV para possibilitar a Integração dos novos bays 04N2  04N3 às BARRAS 04B1  04B2 da SE IGAPORÃ III - IGT.
835020|2020-08-14 08:18:40|Verificar e sanar falha na partida do Gae Principal   2 - Ensaios operacionais.
835099|2020-08-14 11:52:52|Substituição de placa transponder do sistema ótico IPG modelo TXP STM XF, serviço a ser executado na repetidora 06 - Pedra Petra - MT
835200|2020-08-14 16:03:55|Instalação da infraestrutura do sistema de supervisório SAGE para ampliação etapa do autotransformador TR2.
835217|2020-08-14 16:40:39|Inspeção,no circuito 16W2 apresentou RUÍDO ANORMAL.
835303|2020-08-15 15:47:27|às 14h28min houve abertura dos disjuntores de 12KV de Mangueira III comprometendo mais de 10% da geração do Conjunto Eólico Marmeleiro 2, a equipe de campo se deslocou até o local para inspeção na LT.
835333|2020-08-16 10:25:26|Verificar e sanar falha de comunicação com a remota da SE João Monlevade 2.
835429|2020-08-17 11:39:38|Teste de integração do novo sistema de supervisão local para comissionamento do Vão 4P. Download eventual nos gateways e  ou Remota D200 durante testes.
835568|2020-08-17 20:12:36|MANUTENÇÃO CORRETIVA NO SISTEMA DE SUPERVISÃO E CONTROLE DA SE SIDROLÂNDIA 2.
835574|2020-08-17 21:08:15|MIGRAÇÃO DOS CANAIS DE VOZ HOTLINE (1 e 2) COM O COSR-SE,  DA SEDE ANTIGA PARA NOVA SEDE DA CELEO REDES.
835606|2020-08-18 10:07:01|INSTALAÇÃO DA ALIMENTAÇÃO REDUNDANTE (FONTE SEGURA), PARA O DATA CENTER DA USINA.
835624|2020-08-18 10:53:31|ADEQUAÇÕES NA BASE DE DADOS DAS UAC 5 ( VÃO UG01) E UAC 7 (VÃO UG03).
835649|2020-08-18 11:38:41|Reinstalação de módulos de comunicação (TS) nos painéis IHM 1 e 2 para permitir redundância no sistema de supervisão SAGE (local  COT)   2  Testes de falha em PCs gateways para verificação da redundância do sistema.
835782|2020-08-18 19:30:32|Teste de subida de pontos do bay de ILS-II para o SAGE e COT  Configuração da Base de Dados da UTR  em JAL  Implementação da nova base na UTR STD.
835783|2020-08-18 19:49:13|MANUTENÇÃO PROGRAMADA CORRETIVA DA ALGAR TELECOM NO CANAL DE COMUNICAÇÃO QUE ATENDE O COSR-S.
835833|2020-08-19 09:58:25|RESET FISICO DO RADIO SRAL. RÁDIO PDH - SRAL XD - SIEMENS - ALARME DE   R CHANNEL ALARM ON   (INTEROPERABILIDADE ENTRE RÁDIOS SRAL) NO RÁDIO FRBH-02, E CONSEQUENTE FALHA DE GERENCIAMENTO E SUPERVISÃO DOS RÁDIOS FRAL-01 E FRAL-02 (CAMPO ALEGRA) E ERII-01 (IPAMERÍ).
835839|2020-08-19 10:20:41|EXECUTAR ATUALIZAÇÃO DE BASE DE DADOS DO SAGE DA SE-BACABEIRA (MA) PARA PERMITIR O RECEBIMENTO DE DADOS DE MEDIDAS ANALÓGICAS E DIGITAIS E COMANDO NO CENTRO DE OPERAÇÃO DE BACKUP EM BRASÍLIA.
835867|2020-08-19 11:33:45|ATUALIZAR BASE DE DADOS DO SDSC  SAGE PARA COT LAGES
835899|2020-08-19 12:21:18|SUBSTITUIR ALIMENTAÇÃO DOS PAINÉIS TELECOM DE 125VCC PARA OS BANCOS E RETIFICADORES 48VCC.
835917|2020-08-19 13:39:21|MANUTENÇÃO GERAL NOS EQUIPAMENTOS DA UFV PARACATU NA SE PARACATU E SE PARACATU 4.
835921|2020-08-19 13:47:23|Perdas momentâneas de supervisão por tempo de reset. Inclusão e ensaio da base de dados referentes ao BC-1 138kV.
835926|2020-08-19 13:58:43|Perdas momentâneas de supervisão por tempo de reset. Verificar falha na UCC2, atualizar base de dados do SASE, incluindo pontos a serem ativados com o retrofit da proteção do circuito LT SSA-SCX 525kV.
835995|2020-08-19 16:44:52|Atualização da base de dados do SSC SAGE do COT - CELG GT para o novo SPCS do Trafo 6 (230  138 kV) da SE Anhanguera e para corrigir anomalia nos comutadores de TAP da SE Itapaci.
836007|2020-08-19 17:14:52|Liberação da LT 02N5 PFE  SPF.
836027|2020-08-19 18:13:02|LIMPEZA DO MURO LATERAL DA CALHA DO VERTEDOURO PARA MAPEAMENTO DE FISSURAS.
836167|2020-08-20 14:49:10|Realizar substituição  cabo condutores  danificados entre as estruturas 13  0 e 13  01 da LT 138 KV entre SE João Câmara III a SE Asa Branca
836229|2020-08-20 17:35:42|Atualização das bases do SAGE no COT na SE Miracema.
836264|2020-08-21 05:54:48|Falha de dados da SE Polo Guamaré para o ONS.
836276|2020-08-21 08:48:45|aplicações trifásicas, com 3000 A durante 0,3 s na linha, cada aplicação. 
836315|2020-08-21 10:30:59|Realizar manutenção preventiva anual no Sistema de Supervisão e Controle da Subestação de SE Maçambará.
836323|2020-08-21 10:41:22|Realizar manutenção preventiva anual no Sistema de Supervisão e Controle da Subestação de SE Uruguaiana.
836362|2020-08-21 12:11:39|Verificar e sanar falha de comunicação da remota da UHE Sá Carvalho.
836388|2020-08-21 14:15:39|Realizar teste de energização e comissionamento do parque eólico São Januário SJA-04, circuito C3 e C4. Aerogeradores: 01, 02, 03, 04, 05, 06 e 07.
836448|2020-08-21 16:44:47|INSERIR NA PROTEÇÃO DE  BARRAS 1  2 O BAY DA  LINHA PNMR-LI7-01 DA ACESSANTE OMEGA ENERGIA.
836528|2020-08-22 08:38:54|indisponibilidade dos Aerogeradores 14 ao 21 da LD 03, para realização da manobra de fechamento do disjuntor da Switchgear do WTG21, devido o mesmo está com nível baixo de gás SF6,
836667|2020-08-24 11:19:33|Alteração da configuração da rede de comunicação que atende o COG.
836705|2020-08-24 14:07:25|Transferência do Centro de Operação COE Visus, para CROP Chesf, para operação remota da SE GPX, EL 04P2 PND  GPX, LT e RMTs associadas. Integração da proteção da barra, integração do 04T2 e integração da 04P2  PND. equipe irá efetuar testes de N2: Comando de seccionadoras e disjuntores.
836696|2020-08-24 13:20:44|RESET FISICO DO RADIO SRAL. RÁDIO PDH - SRAL XD - SIEMENS - ALARME DE   R CHANNEL ALARM ON   (INTEROPERABILIDADE ENTRE RÁDIOS SRAL) NO RÁDIO FRBH-02, E CONSEQUENTE FALHA DE GERENCIAMENTO E SUPERVISÃO DOS RÁDIOS FRAL-01 E FRAL-02 (CAMPO ALEGRA) E ERII-01 (IPAMERÍ).
836711|2020-08-24 14:19:48|ADEQUAÇÃO E TESTES DE CIRCUITOS NA PROTEÇÃO DIFERENCIAL DE BARRAS PARA IMPLANTAÇÃO DO NOVO AT03
836735|2020-08-24 14:53:14|GERAÇÃO DA BASE DE DADOS DO CTRM-FURNAS E DO COS-FURNAS PARA ACERTOS DA BASE DE DADOS DO SISTEMA SOL
836768|2020-08-24 15:55:30|TRANSFERÊNCIA DA SE AML DE MTT  02V3 PARA PTU  02J7 PARA INSPEÇÃO TERMOGRÁFICA NA LT 02J7 TRECHO SUBTERRÂNEO. TEMPO DE RETORNO IMEDIATO.
836815|2020-08-24 19:51:01|RESTRIÇÃO DE GERAÇÃO NA UHE PARA POSSIBILITAR A TRANSPOSIÇÃO DE PLANTAS AQUÁTICAS ESTACIONADAS NOS RETENTORES DE CORPOS FLUTUANTES (LOG BOOM) PELA COMPORTA DE SEGMENTO N.º 4 DO VERTEDOURO DE SUPERFÍCIE, DEVIDO AO GRANDE VOLUME ACUMULADO.
836830|2020-08-24 20:45:58|Energização dos bay 12C1 e 12S4 SE AUD (CHESF) e LDAT 02C4 AUD  ACA e 02S4 AUD  MRC com transferência definitiva da SED MRC, SED BXD, SED ACA, SED CRZ e SE BXU da SE SBD para a SE AUD
836915|2020-08-25 11:11:33|Atualização da base de dados dos servidores Sage de Araraquara e CD1 com correção dos sinais de posição dos disjuntores de carga do serviço auxiliar de Araraquara. -Atualização da base de dados dos servidores Sage CPV com alteração no tempo de time-out para comunicação com Series V para analisar se as falhas de comunicação irão cessar.
836935|2020-08-25 11:59:30|MANUTENÇÃO CORRETIVA NO RETIFICADOR 1 DO SERVIÇO AUXILIAR DA EOL MALHADINHA I NA SE IBIAPINA II.
836962|2020-08-25 14:27:40|Substituição da TRM41 do relé de proteção UPD1-CX e QPC1-7DX
837035|2020-08-25 16:34:07|Atualizar a base de dados do Sage SUL, DORSO, em face da entrada de novos empreendimentos de engenharia (Obras Chesf).
837079|2020-08-25 21:12:24|MANUTENÇÃO CORRETIVA DO SISTEMA DE SUPERVISÃO E CONTROLE DA VCTE NA SE VILA DO CONDE.SUBSTITUIÇÃO DA UNIDADE DE CONTROLE UCD3X DO REATOR DE LINHA VCRE7-03 DA SE VC.
837230|2020-08-26 15:17:51|DORBP - INTEGRACAO TJMM  EQUATOR 05B1 IGT Acessantes JMM  Cymi, EQUATORIAL e contratadas, com o acompanhamento da CHESF,  realizarão a integração das LT  04N2  04N3 e LT 05L6  05L7, respectivamente, à topologia da proteção diferencial do barramento 05B1 da SE IGT.
837308|2020-08-27 09:24:34|Lavagem em carga dos isoladores da subestação 230kV do conjunto eólico Aracati II.
837396|2020-08-27 12:17:18|Integração da rede de dados referente ao CAG da SE Arinos 2 com o ONS Sudeste.
837426|2020-08-27 14:42:43|Manutenção programada pela operadora Claro  Embratel. Essa atividade poderá ocasionar indisponibilidade nos canais de voz (HOT LINE) entre o ONS e o COT Energisa.
837535|2020-08-27 19:21:07|Verificar falha de comunicação entre UTR e UPP  UPA
837631|2020-08-28 11:05:24|PARADA DO CLP DO AUTOMATISMO DO SERVIÇO AUXILIAR, PARA POSSIBILITAR A GRAVAÇÃO DO SOFTWARE NA MEMÓRIA EPROM EM VIRTUDE DA ADEQUAÇÃO DOS PONTOS ANALÓGICOS PARA O COG   2- ATUALIZAÇÃO DO SOFTWARE DO AUTOMATISMO E TESTES DE SINALIZAÇÃO E COMANDO DA UG-2 COM O COG.
837694|2020-08-28 14:12:33|Teste de contingência nos circuitos de telecomunicações entre o COSR-SE e a XRTE.
837864|2020-08-30 08:17:44|Abertura dos disjuntores 19G1-2 e 19G1-3 para correção no ponto quente na fase B do circuito 3 de BURITI. Restrição operativa de 19,5MW.
837866|2020-08-30 08:28:58|Abertura dos disjuntores 19G1-2 e 19G1-3 de Buruti para correção no ponto quente na fase B do circuito 3 de BURITI. Restrição operativa de 20MW.
837879|2020-08-30 20:52:22|Realização de testes remotos simulados na UCD-1.
837902|2020-08-31 09:42:32|Equipe DORBP: Efetuar MC na falha de abertura dos disjuntores 12P1  12P2  12P3  12P4 e abertura do 12P6 na ocorrência do dia 11  06  2020.
832971|2020-08-03 09:36:55|Substituição de equipamento da rede de comunicação via fibra, para garantir a integridade e estabilidade da rede. Os serviços serão realizados pela empresa Internexa, nos links ópticos que atendem a comunicação do SVC-SBO, na central em Curitiba.
833012|2020-08-03 10:59:50|Configuração de rota alternativa para redundância dos canais essenciais (dados, voz  hotline) da LT SM2-LUZ via canal Taesa (SM2-SM1-SAM)
833093|2020-08-03 15:48:13|Corrigir discrepância da medição de MW maquina 01G2  USQ entre medição local e medição SAGE(CROP  ONS).
833197|2020-08-04 10:09:16|MANUTENÇÃO CORETIVA COM A MIGRAÇÃO DO MUX MAIN DIREÇÃO GURUPI PARA SISTEMA SAR  MPLS, DEVIDO A ALTA INTERMITÊNCIA DE ALARMES DOS CANAIS 1,2 E 3 DA TELEPROTEÇÃO PRIMÁRIA DA LTSMGU 1.
833198|2020-08-04 10:19:08|Limpeza das grades de proteção da Tomada Dágua da PCH Passo do Meio.
833332|2020-08-04 15:57:34|MANUTENÇÃO PREVENTIVA NOS EQUIPAMENTOS DE ACIONAMENTO DA COMPORTA 4 DO VERTEDOURO.
833347|2020-08-04 16:36:03|Equipes DORBP  DORBT  JPW  ESC: Solicitar a primeira energização do EL 09W3   disjuntores 19W3   e TCs 99W3-1, 99W3-2, TPs 89W3.
833363|2020-08-04 17:19:23|TESTE DE CARGA DO GMG DE 345KV E GMG DE 500KV, SENDO OPERADOS PELO AUTOMATISMO.
833366|2020-08-04 17:30:40|VERIFICAR E SANAR A CAUSA DA FALHA DE COMUNICAÇÃO DE DADOS DO BAY DO CETR NA SE-PÉCEM II.
833434|2020-08-05 10:47:38|Atualização do drive de comunicação do relé 02T1P da EOL Morro dos Ventos 69kV.
833499|2020-08-05 13:52:04|Verificações e testes nos alarmes dos reles de proteção com a Remota STD.
833502|2020-08-05 14:16:01|Bloqueio da proteção diferencial da barra 230kV da SE CSO, para permitir manobras de transferência dos circuitos da barra BP-1 para a barra BP-2 programadas para atender ao SGI 31513-20. O bloqueio será necessário das 09:15 as 10:00hs esta SGI  e novamente das 16:15 as 17:00Hs ( SGI 31558-20).
833512|2020-08-05 14:37:48|FALHA NA SUPERVISÃO DO BAY DE CONEXÃO NA SE PECÉM II, SENDO OCASIONADO POR DEFEITO NO LINK DE COMUNICAÇÃO POR FIBRA ÓPTICA.
833532|2020-08-05 15:24:17|Implantação da função Unidade de Medida Fasorial (PMU) conforme autorização SGPMR 018658  2015.
833534|2020-08-05 15:29:42|Equipe DORBP realizar intervenção em atendimento ao Plano de Manutenção Preventiva dos Servidores SAGE da SE BMC do ano de 2020.
833580|2020-08-05 17:34:31|Correção de ponto quente na seccionadora 33L1-4 (146ºC) e DJ 19G2 (84ºC)
833593|2020-08-05 18:55:00|CHESF realizar Retrofit PLCs GE   TSD Conclusão dos retrofits dos PLCs GE e retirada de Pendências: 1. Necessário acesso aos painéis dos Trafos 05T1  05T2, CS 01K1 e Serviço Auxiliar   2. PLCs Trafos 05T1  05T2: Durante a substituição dos PLCs dos Trafos 05T1 e 05T2 haverá perda de supervisão das medidas de temperatura de oleo e enrolamento do Trafo bem como os comandos em N1,N2 e N3 para os ventiladores. O tempo desta indisponibilidade será de até 6 horas, Podendo ocorrer mais de uma vez   3. PLC Serviço Auxiliar: Serão realizados testes de sinalização e telecomando PLC  SAGE para retirada de pendências, os testes serão Previamente nivelados com a operação da instalação   4. PLC CS 01K1: Haverá perda de Supervisão do Compensador Síncrono por um prazo de até 1 hora, podendo ocorrer mais de uma vez   5. Haverá atualização do SAGE N2, causando indisponibilidade no SAGE N2 e N3 por um período de até 1 hora. 6. Todas as indisponibilidades serão previamente niveladas com a operação.
833611|2020-08-06 07:12:31|Verificar e sanar o motivo do desligamento intempestivo do circuito 09C4  BNT. sob atuações de sobrecorrente temporizada e sobrecorrente temportizada a terra
833640|2020-08-06 10:32:21|Testes de comunicação  monitoramento da rede, para identificação de causas de alarmes de Falha GOOSE.
833644|2020-08-06 10:48:36|Verificar abertura do DJ19T01 do lado de 34,5kV do Transformador 04T01 do Complexo Eólico Lagoa do Barro.
833788|2020-08-06 18:42:31|Realizar testes e modulação nos controles de Cosphi (Fator de Potência), Potência Reativa e Tensão nos aerogeradores do parque eólico Vila Acre II (aerogeradores 09, 08, 07, 06, 05, 04, 03, 02 e 01) pertencentes ao Conjunto Eólico Amazonas.
833833|2020-08-07 09:53:08|TRANSFERÊNCIA DAS CARGAS DE CMU DE CMD PARA CTG AFIM DE PERMITIR LIBERAÇÃO DA LT 02L6  CPC PARA  MANUTENÇÃO NA SE CMU
833913|2020-08-07 13:47:48|Descarregar os ajustes do sistema de supervisão e controle referente a teleproteção LT Emborcação - São Gotardo 2 500 kV.
833924|2020-08-07 14:48:42|Atualização da base de dados do SSC SAGE da SE Palmeiras.
833925|2020-08-07 14:49:20|Correção de BUG visual no SCADA dos parques eólicos de Santo Antonio de Pádua, São Cristóvão e São Jorge.
833932|2020-08-07 15:09:21|Acessante JMM  Cymi, e contratadas, com o acompanhamento da CHESF, realizar os testes de Integração do novo painel e proteção diferencial de barras 230 kV aos bays da CHESF para possibilitar a Integração dos novos bays 04N2  04N3 às 04B1  04B2 da SE IGT.
834038|2020-08-08 11:28:47|Verificações e testes no telecomando de Ligar  Desligar do DJ 35452-106.
834130|2020-08-10 11:05:29|MANUTENÇÃO CORRETIVA NO PAINEL CCLP (CLP MASTER A  B) EM VIRTUDE DE RUÍDO ANORMAL PROVENIENTE DE UM DOS MÓDULOS ELETRÔNICOS PERTENCENTES AO ECE765KV.
834138|2020-08-10 11:18:41|ATUALIZAÇÃO DA BASE DE DADOS DO SAGE PARA: CORREÇÃO DE PONTOS DE DISTRIBUIÇÃO DE MEDIDAS ANALÓGICAS PARA O CTRR E INFORMAÇÕES RELATIVAS A TROCA DO DISJUNTOR DE AMARRE 138 kV (DJ606) E DA SECCIONADORA SC605
834208|2020-08-10 14:36:12|Reparo no sinal de supervisão da seccionadora 2700 de 230kV da UTR Escrava da Usina Subterrânea.					
834251|2020-08-10 16:15:54|Instalação de novas réguas para leitura de nível no barramento do reservatório de Antônio Dias, próximo ao vertedouro. 
834296|2020-08-10 18:03:54|Implantação da BD 462 do SAGE.
834311|2020-08-10 20:16:22|Indisponibilidade dos controles de Potência Ativa e Reativa do complexo eólico Riachão, devido à falha no sistema Scada WindAccess.
834559|2020-08-11 18:28:38|MANUTENÇÃO CORRETIVA NA BASE DE DADOS DO SAGE E NAS LÓGICAS DAS UCDs VISANDO ENTRADA EM OPERAÇÃO DO AT05 NA SE VITÓRIA
834580|2020-08-12 08:43:41|Realizar manutenção preventiva no Inversor da subestação Santa Maria 3.
834654|2020-08-12 12:08:46|Realização de testes em modo ilha da UTE Novo Paraiso.
834723|2020-08-12 16:24:11|Corrigir falha na sinalização do 35352-7 na IHM, devido não estar mudando de estado de fechado para aberto
834740|2020-08-12 17:07:44|Reconfiguração física e lógica do sistema de supervisão e controle da subestação da UHE Dona Francisca.
834762|2020-08-12 18:32:54|Verificações e testes em pontos de supervisão inválidos para o COT
834839|2020-08-13 10:45:37|GERAÇÃO DA BASE DE DADOS DO CTRS-FURNAS E DO COS-FURNAS PARA ACERTOS DA BASE DE DADOS DO SISTEMA SOL
834858|2020-08-13 11:23:04|Retirada de ponto quente em chave monopolar(Sec-A02) de saída do circuito A2 e A1.
834862|2020-08-13 11:32:25|Substituir relé de supervisão e controle de temperatura (Simotemp) do ATR RESERVA.
834879|2020-08-13 12:27:09|Atualização da base de dados do SAGE da Amazonas Energia Distribuidora, com a entrada do novo transformador n.04 de 69  13,8kV da Subestação São José.
834908|2020-08-13 14:48:16|Manutenção preventiva anual da SE Ribeiro Gonçalves, nos Sistemas de Supervisão e Controle (SSC), Telecomunicação, Conversores CV1 e CV2 e nos sistemas de Teleproteção Principal e Alternada das LTs 500 kV Colinas  Ribeiro Gonçalves C1 e Ribeiro Gonçalves  São João do Piauí C1   2) Instalação da segunda fonte de alimentação dos firewalls FW 01 e 02 da SE Ribeiro Gonçalves.
834929|2020-08-13 15:24:27|Substituição do transformador pad mounted 09T07-C2 da usina eólica Icaraizinho.
834939|2020-08-13 15:49:21|RETIRADA DE PONTOS QUENTES NAS SECCIONADORAS DOS BAYS DA SE DELTA 3 E SE DELTA 6 DO CONJUNTO EÓLICO PAULINO NEVES.
835039|2020-08-14 09:45:00|Manutenção na rede de comunicação da  ENGIE para incremento de segurança cibernética.
835040|2020-08-14 09:46:10|Desligamento da LD Uberlândia 7 - US Miranda 138kV, por solicitação da CEMIG DISTRIBUIÇÃO, para intervenções no terminal da SE Uberlândia 7 e na estrutura 19 da LD.
835043|2020-08-14 09:52:41|Manutenção corretiva, através de mergulho, no sistema de adução (Grades) da UG1.
835189|2020-08-14 15:53:34|Atualização das regras do firewall operativo CEMIG para atendimento a futura comunicação com as localidades de SE Aracaú e Parque eólico Volta do Rio.
835216|2020-08-14 16:35:28|Serviços inspeção, no circuito 19W2. Circuito com ruido anormal.
835325|2020-08-15 23:33:35|Houve desligamento automático da usina Monte Cristo II, por baixa tensão no barramento de 13,8 kV, equipe de manutenção está fazendo inspeção para detectar o problema.
835405|2020-08-17 10:17:32|INTERVENÇÃO COM LIBERAÇÃO DA LINHA 03F2 TFD - TEF.
835529|2020-08-17 16:53:03|Execução dos procedimentos operacionais para implantação de novos ativos de rede no datacenter do Rio de Janeiro. A execução do procedimento acima, poderá ocasionar instabilidade nos serviços do datacenter do Rio de Janeiro  .  A duração estimada para a conclusão da atividade será de  duas horas, iniciando à 01:00 hora, sendo concluída às 3:00 horas.
835570|2020-08-17 20:42:19|MIGRAÇÃO DOS CANAIS DE VOZ HOTLINE (1 e 2) COM O COSR-S,  DA SEDE ANTIGA PARA NOVA SEDE DA CELEO REDES.
835641|2020-08-18 11:21:44|Verificar e sanar a perda de supervisão do SAGE da casa de força leito do rio.SCL-LR - UG33 a UG50.TRUG4850, LIS2PV1-1 e LIS2PV1-2.
835648|2020-08-18 11:39:44|ATIVAÇÃO  MIGRAÇÃO DA REDUNDÂNCIA DA REDE SAGE VIA ENLACE SATÉLITE - OPERADORA VIVO - CONTRATO: 4500088962.
835657|2020-08-18 12:44:14|Descida da caixa de emenda do OPGW (ROPA), para inspeção.
835679|2020-08-18 14:23:43|Manutenção preventiva no sistema de supervisão e controle da SE Pirapora 2 (LTMC).
835707|2020-08-18 15:48:17|Realizar teste de energização e comissionamento do parque eólico São Januário SJA-01, circuito C1 e C2. Aerogeradores: 01, 02, 03, 04, 05, 06 ,07. e 08
835711|2020-08-18 16:05:35|Manutenção SE IPT.
835721|2020-08-18 16:39:16|NORMALIZAÇÃO DO SISTEMA DE COMUNICAÇÃO DO SAGE 1 E 2  DA SE PORTO FRANCO: - REALIZAR SUBSTITUIÇÃO DE MÓDULOS DE COMUNICAÇÃO NO ROTEADOR CISCO RESPONSÁVEL PELA COMUNICAÇÃO DOS SAGE 1 E 2 EM PORTO FRANCO.
835819|2020-08-19 09:24:07|Retirada de pontos quentes nos equipamentos do conjunto eólico Licínio de Almeida.
835828|2020-08-19 09:52:51|MIGRAÇÃO DOS CANAIS DE VOZ HOTLINE (1 e 2) COM O COSR-NCO,  DA SEDE ANTIGA PARA NOVA SEDE DA CELEO REDES.
